{
  "$schema": "./archive-catalog.schema.json",
  "description": "Editable catalogue for the homepage selection and All work archive. Filename keys must match the image files; all other fields may be edited.",
  "featured": [
    "archInk-2021-PC.jpg",
    "archInk-2021-WhatThisAwlMeans.jpg",
    "archInk-2024-2.jpg",
    "illustration-bell-beaker.jpg",
    "illustration-bias-eurocentism copy.jpg",
    "illustration-burial-dog-human.jpg",
    "illustration-fueled-by-coffee.jpg",
    "illustration-funnel-beaker-cluster.jpg",
    "illustration-gender-bias.jpg",
    "illustration-kore-reconstruction.jpg",
    "illustration-ochre.jpg",
    "illustration-torso-statue.jpg",
    "Babylon-map.jpg",
    "europe-graffiti-history-spray-can.jpg",
    "trier-roman-economy-geology-and-raw-materials-map.webp",
    "trier-roman-pottery-workshop-reconstruction-close.webp",
    "archaeological-multi-tool.jpg",
    "digital-elevation-model.jpg",
    "bell-beaker-map.jpg",
    "archaeological-stratigraphy.png",
    "pastrace-brand-identity.webp",
    "suriname-tijdmachine-1.webp",
    "necessary-reunions.png"
  ],
  "works": {
    "ochre-painting.jpg": {
      "sourceFolder": "all-work",
      "title": "Ochre",
      "alt": "Illustrated study of ochre pigments, hand stencils and painting tools",
      "category": "illustration",
      "collection": "main",
      "visible": true,
      "order": 2,
      "practice": "Archaeological illustration",
      "form": "Standalone visual study",
      "tools": [
        "Digital illustration"
      ],
      "context": "Independent work",
      "credits": "Research and illustration"
    },
    "kore-reconstruction-coloured.jpg": {
      "sourceFolder": "all-work",
      "title": "Kore in colour",
      "alt": "Three-stage reconstruction of a Kore sculpture with colour",
      "category": "illustration",
      "collection": "main",
      "visible": true,
      "order": 3,
      "practice": "Visual reconstruction",
      "form": "Comparative illustration",
      "tools": [
        "Digital illustration"
      ],
      "context": "Independent work",
      "credits": "Research and reconstruction"
    },
    "Babylon-map.jpg": {
      "sourceFolder": "all-work",
      "title": "The world from Babylon",
      "alt": "Illustrated explanation of the Babylonian Map of the World",
      "category": "illustration",
      "collection": "main",
      "visible": true,
      "order": 4,
      "practice": "Visual explanation",
      "form": "Annotated object study",
      "tools": [
        "Illustration",
        "Information design"
      ],
      "context": "Independent work",
      "credits": "Research, illustration and design"
    },
    "suriname-tijdmachine-1.webp": {
      "sourceFolder": "archive",
      "title": "Suriname Tijdmachine",
      "alt": "Suriname Time Machine website shown across several screens",
      "category": "web-interfaces",
      "collection": "main",
      "visible": true,
      "order": 5,
      "year": "2025–2026",
      "practice": "Web and interfaces",
      "form": "Project plate",
      "tools": [
        "Figma",
        "TypeScript",
        "React",
        "Leaflet",
        "Linked data"
      ],
      "context": "Huygens Institute and project partners",
      "credits": "Interface design and front-end development"
    },
    "gender-bias.jpg": {
      "sourceFolder": "all-work",
      "title": "Gender bias",
      "alt": "Illustration about gender bias in archaeological interpretation",
      "category": "illustration",
      "collection": "main",
      "visible": true,
      "order": 6,
      "practice": "Visual science communication",
      "form": "Editorial illustration",
      "tools": [
        "Illustration",
        "Information design"
      ],
      "context": "Independent work",
      "credits": "Research and illustration"
    },
    "hatching-torso-statue.jpg": {
      "sourceFolder": "all-work",
      "title": "Venus",
      "alt": "Tonal illustration of a sculpted torso",
      "category": "illustration",
      "collection": "main",
      "visible": true,
      "order": 7,
      "year": "2023",
      "practice": "Visual reconstruction",
      "form": "Figure study",
      "tools": [
        "Digital watercolour"
      ],
      "context": "Independent work",
      "credits": "Illustration",
      "series": {
        "id": "torso",
        "title": "Torso studies"
      }
    },
    "burial-dog-human.jpg": {
      "sourceFolder": "all-work",
      "title": "Friends",
      "alt": "Ink drawing of a human and dog burial",
      "category": "illustration",
      "collection": "studies",
      "visible": true,
      "order": 9,
      "year": "2023",
      "practice": "Visual reconstruction",
      "form": "Prompt drawing",
      "tools": [
        "Ink",
        "Digital drawing"
      ],
      "context": "Self-initiated",
      "credits": "Concept and illustration"
    },
    "bell-beaker.jpg": {
      "sourceFolder": "all-work",
      "title": "Bell Beaker",
      "alt": "Black-and-white archaeological drawing of a Bell Beaker vessel",
      "category": "illustration",
      "collection": "main",
      "visible": true,
      "order": 11,
      "practice": "Archaeological illustration",
      "form": "Object study",
      "context": "Independent work",
      "credits": "Illustration",
      "series": {
        "id": "bell-beaker",
        "title": "Bell Beaker studies"
      }
    },
    "Ancient-Shell-Tools.jpg": {
      "sourceFolder": "all-work",
      "title": "Shell",
      "alt": "archInk object study with a coloured shell at its centre",
      "category": "illustration",
      "collection": "studies",
      "visible": true,
      "order": 13,
      "year": "2025",
      "practice": "archInk",
      "form": "Object constellation",
      "context": "Self-initiated",
      "credits": "Research and illustration"
    },
    "Residue.jpg": {
      "sourceFolder": "all-work",
      "title": "Residue",
      "alt": "Four-panel archInk drawing about archaeological residue analysis",
      "category": "illustration",
      "collection": "studies",
      "visible": true,
      "order": 14,
      "year": "2025",
      "practice": "archInk",
      "form": "Four-panel sketch",
      "context": "Self-initiated",
      "credits": "Research and illustration"
    },
    "Bronze.jpg": {
      "sourceFolder": "all-work",
      "title": "Bronze",
      "alt": "archInk illustration of bronze artefacts and hands",
      "category": "illustration",
      "collection": "studies",
      "visible": true,
      "order": 15,
      "year": "2025",
      "practice": "archInk",
      "form": "Material study",
      "context": "Self-initiated",
      "credits": "Research and illustration"
    },
    "necessary-reunions.png": {
      "sourceFolder": "archive",
      "title": "Necessary Reunions",
      "alt": "Necessary Reunions",
      "category": "web-interfaces",
      "collection": "main",
      "visible": true,
      "order": 16,
      "year": "2025",
      "practice": "Web and interfaces",
      "form": "Project plate",
      "tools": [
        "Figma",
        "React",
        "IIIF",
        "Georeferencing"
      ],
      "context": "Huygens Institute and University of Amsterdam",
      "credits": "Research, interface design and user experience"
    },
    "pastforwardhub-2.webp": {
      "sourceFolder": "archive",
      "title": "PastForwardHub",
      "alt": "PastForwardHub",
      "category": "web-interfaces",
      "collection": "main",
      "visible": true,
      "order": 17,
      "year": "2025–present",
      "practice": "Web and interfaces",
      "form": "Project plate",
      "tools": [
        "Figma",
        "Next.js",
        "TypeScript"
      ],
      "context": "PastForwardHub",
      "credits": "Co-founder, design and web development"
    },
    "pastrace-brand-identity.webp": {
      "sourceFolder": "all-work",
      "title": "PasTrace",
      "alt": "PasTrace",
      "category": "brand-graphic-design",
      "collection": "main",
      "visible": true,
      "order": 18,
      "year": "2023",
      "practice": "Brand and graphic design",
      "form": "Brand identity plate",
      "tools": [
        "Procreate",
        "Vector design"
      ],
      "context": "PasTrace",
      "credits": "Logo design and brand identity development"
    },
    "archInk-2020-overview.jpg": {
      "sourceFolder": "all-work",
      "title": "archInk 2020: 31 drawings",
      "alt": "Overview of all 31 archInk drawings made for Inktober 2020, arranged by prompt number",
      "category": "illustration",
      "collection": "main",
      "visible": true,
      "order": 19,
      "year": "2020",
      "practice": "archInk",
      "form": "Series overview",
      "context": "Inktober 2020; prompt list by Dr. K. Cook",
      "credits": "Illustrations and layout by Jona Schlegel"
    },
    "archInk-2023-overview.jpg": {
      "sourceFolder": "all-work",
      "title": "archInk 2023: 31 drawings",
      "alt": "Overview of all 31 archInk drawings made for Inktober 2023, arranged by prompt number",
      "category": "illustration",
      "collection": "main",
      "visible": true,
      "order": 20,
      "year": "2023",
      "practice": "archInk",
      "form": "Series overview",
      "context": "Inktober 2023; prompt list by the Black Trowel Collective",
      "credits": "Illustrations and layout by Jona Schlegel"
    },
    "a-long-time-ago.jpg": {
      "sourceFolder": "all-work",
      "title": "A Long Time Ago",
      "alt": "A Long Time Ago",
      "category": "illustration",
      "collection": "main",
      "visible": true,
      "order": 1000,
      "practice": "Illustration",
      "form": "Illustration"
    },
    "archInk-2021-PC.jpg": {
      "sourceFolder": "landing-page",
      "title": "archInk 2021 Pc",
      "alt": "archInk 2021 Pc",
      "category": "illustration",
      "collection": "studies",
      "visible": true,
      "order": 1000,